"id","title","vote_average","vote_count","status","release_date","revenue","runtime","adult","backdrop_path","budget","homepage","imdb_id","original_language","original_title","overview","popularity","poster_path","tagline","genres","production_companies","production_countries","spoken_languages"
"85","Raiders of the Lost Ark","7.924","11483","Released","1981-06-12","389925971","115","False","/f3XrGXd34Ru7o39LUwWvk5igEV7.jpg","18000000","http://www.indianajones.com","tt0082971","en","Raiders of the Lost Ark","When Dr. Indiana Jones – the tweed-suited professor who just happens to be a celebrated archaeologist – is hired by the government to locate the legendary Ark of the Covenant, he finds himself up against the entire Nazi regime.","60.763","/ceG9VzoRAVGwivFU403Wc3AHRys.jpg","Indiana Jones - the new hero from the creators of JAWS and STAR WARS.","Adventure, Action","Paramount, Lucasfilm Ltd.","United States of America","English, Spanish, German, Hebrew, Arabic, Nepali"
"19908","Zombieland","7.3","11466","Released","2009-10-07","102391540","88","False","/oihWVx3imvRKujnGmSDYhfG1gI5.jpg","23600000","https://www.sonypictures.com/movies/zombieland","tt1156398","en","Zombieland","Columbus has made a habit of running from what scares him. Tallahassee doesn't have fears. If he did, he'd kick their ever-living ass. In a world overrun by zombies, these two are perfectly evolved survivors. But now, they're about to stare down the most terrifying prospect of all: each other.","32.08","/dUkAmAyPVqubSBNRjRqCgHggZcK.jpg","Nut up or shut up.","Comedy, Horror","Pariah, Columbia Pictures, Relativity Media","United States of America","English"
"127380","Finding Dory","7.042","11429","Released","2016-06-16","1028570889","97","False","/8yYuFjRsozwOckhAaTHRLTiDwml.jpg","200000000","http://movies.disney.com/finding-dory","tt2277860","en","Finding Dory","Dory is reunited with her friends Nemo and Marlin in the search for answers about her past. What can she remember? Who are her parents? And where did she learn to speak Whale?","26.562","/3UVe8NL1E2ZdUZ9EDlKGJY5UzE.jpg","An unforgettable journey she probably won't remember.","Adventure, Animation, Comedy, Family","Pixar, Walt Disney Pictures","United States of America","English"
"296096","Me Before You","7.918","11414","Released","2016-06-01","207945075","110","False","/7jjwdoIVPJp7gcDo9uE1sVZi2Rs.jpg","20000000","http://www.mebeforeyoumovie.net","tt2674426","en","Me Before You","A small town girl is caught between dead-end jobs. A high-profile, successful man becomes wheelchair bound following an accident. The man decides his life is not worth living until the girl is hired for six months to be his new caretaker. Worlds apart and trapped together by circumstance, the two get off to a rocky start. But the girl becomes determined to prove to the man that life is worth living and as they embark on a series of adventures together, each finds their world changing in ways neither of them could begin to imagine.","79.741","/Ia3dzj5LnCj1ZBdlVeJrbKJQxG.jpg","Live boldly.","Drama, Romance","New Line Cinema, Sunswept Entertainment, Metro-Goldwyn-Mayer","United States of America","English"
"530915","1917","7.99","11395","Released","2019-12-25","394638258","119","False","/2WgieNR1tGHlpJUsolbVzbUbE1O.jpg","100000000","https://www.1917.movie/","tt8579674","en","1917","At the height of the First World War, two young British soldiers must cross enemy territory and deliver a message that will stop a deadly attack on hundreds of soldiers.","44.356","/iZf0KyrE25z1sage4SYFLCCrMi9.jpg","Time is the enemy","War, History, Thriller","DreamWorks Pictures, Reliance Entertainment, New Republic Pictures, Neal Street Productions, Mogambo Films, Amblin Partners","India, Spain, United Kingdom, United States of America","English, French, German"
"398818","Call Me by Your Name","8.167","11367","Released","2017-09-01","43143046","132","False","/zvOJawrnmgK0sL293mOXOdLvTXQ.jpg","4000000","http://sonyclassics.com/callmebyyourname/","tt5726616","en","Call Me by Your Name","In 1980s Italy, a relationship begins between seventeen-year-old teenage Elio and the older adult man hired as his father's research assistant.","32.15","/mZ4gBdfkhP9tvLH1DO4m4HYtiyi.jpg","Is it better to speak or die?","Romance, Drama","La Cinéfacture, RT Features, Frenesy Film, Water's End Productions, M.Y.R.A. Entertainment, CineFinance Italia","Brazil, France, Italy, United States of America","French, English, Italian"
"82693","Silver Linings Playbook","7.13","11327","Released","2012-11-16","236412453","122","False","/92Ppi99LkZFHUgpxwYRxcKZVZNH.jpg","21000000","http://silverliningsplaybookmovie.com/","tt1045658","en","Silver Linings Playbook","After spending eight months in a mental institution, a former teacher moves back in with his parents and tries to reconcile with his ex-wife.","28.014","/y7iOVneBvITlBdhy6tVqXVOa1Js.jpg","Watch For The Signs","Drama, Comedy, Romance","The Weinstein Company","United States of America","English"
"809","Shrek 2","7.249","11323","Released","2004-05-19","928760770","93","False","/wD44moEofk0EZyFxLQItuwdGsvV.jpg","150000000","http://www.shrek2.com/","tt0298148","en","Shrek 2","Shrek, Fiona and Donkey set off to Far, Far Away to meet Fiona's mother and father. But not everyone is happy. Shrek and the King find it hard to get along, and there's tension in the marriage. The fairy godmother discovers that Shrek has married Fiona instead of her Son Prince Charming and sets about destroying their marriage.","82.153","/2yYP0PQjG8zVqturh1BAqu2Tixl.jpg","Once upon another time...","Animation, Family, Comedy, Fantasy, Adventure","DreamWorks Pictures, Pacific Data Images, DreamWorks Animation","United States of America","English"
"14161","2012","5.819","11300","Released","2009-10-10","791217826","158","False","/pvxmYJcgrLiYC6G2IQTn1PPNems.jpg","200000000","http://www.sonypictures.com/movies/2012","tt1190080","en","2012","Dr. Adrian Helmsley, part of a worldwide geophysical team investigating the effect on the earth of radiation from unprecedented solar storms, learns that the earth's core is heating up. He warns U.S. President Thomas Wilson that the crust of the earth is becoming unstable and that without proper preparations for saving a fraction of the world's population, the entire race is doomed. Meanwhile, writer Jackson Curtis stumbles on the same information. While the world's leaders race to build ""arks"" to escape the impending cataclysm, Curtis struggles to find a way to save his family. Meanwhile, volcanic eruptions and earthquakes of unprecedented strength wreak havoc around the world.","51.914","/zaqam2RNscH5ooYFWInV6hjx6y5.jpg","We Were Warned.","Action, Adventure, Science Fiction","Columbia Pictures, Centropolis Entertainment, Farewell Productions, The Mark Gordon Company","United States of America","Tibetan, German, Russian, French, Mandarin, Latin, Portuguese, Spanish, Italian, Hindi, English"
"240","The Godfather Part II","8.591","11293","Released","1974-12-20","102600000","202","False","/kGzFbGhp99zva6oZODW5atUtnqi.jpg","13000000","","tt0071562","en","The Godfather Part II","In the continuing saga of the Corleone crime family, a young Vito Corleone grows up in Sicily and in 1910s New York. In the 1950s, Michael Corleone attempts to expand the family business into Las Vegas, Hollywood and Cuba.","64.753","/hek3koDUyRQk7FIhPXsa6mT2Zc3.jpg","I don't feel I have to wipe everybody out, Tom. Just my enemies.","Drama, Crime","Paramount, The Coppola Company","United States of America","English, Italian, Latin, Spanish"
"14","American Beauty","8.0","11260","Released","1999-09-15","356296601","122","False","/DztBnZaqmla2sGUW9s8AyOmskT.jpg","15000000","","tt0169547","en","American Beauty","Lester Burnham, a depressed suburban father in a mid-life crisis, decides to turn his hectic life around after developing an infatuation with his daughter's attractive friend.","29.837","/wby9315QzVKdW9BonAefg8jGTTb.jpg","Look closer.","Drama","Jinks/Cohen Company, DreamWorks Pictures","United States of America","English"
"70981","Prometheus","6.535","11255","Released","2012-05-30","403354469","124","False","/hO97RyNjBIMfzfFpUjNhsm4zImh.jpg","130000000","https://www.20thcenturystudios.com/movies/prometheus","tt1446714","en","Prometheus","A team of explorers discover a clue to the origins of mankind on Earth, leading them on a journey to the darkest corners of the universe. There, they must fight a terrifying battle to save the future of the human race.","60.299","/m7nZCtHJyDLncBUarfM5h5mrppx.jpg","The Search for Our Beginning Could Lead to Our End","Science Fiction, Adventure, Mystery","Dune Entertainment, Scott Free Productions, Brandywine Productions, 20th Century Fox","United Kingdom, United States of America","Gaelic, English"
"37799","The Social Network","7.358","11190","Released","2010-10-01","224920315","121","False","/2BNKxbq4muNcwTjSDNCYnvr1dM8.jpg","40000000","https://www.sonypictures.com/movies/thesocialnetwork","tt1285016","en","The Social Network","The tale of a new breed of cultural insurgent: a punk genius who sparked a revolution and changed the face of human interaction for a generation, and perhaps forever.","36.101","/n0ybibhJtQ5icDqTp8eRytcIHJx.jpg","You don't get to 500 million friends without making a few enemies.","Drama","Columbia Pictures, Relativity Media, Scott Rudin Productions, Michael De Luca Productions, Trigger Street Productions","United States of America","English"
"166426","Pirates of the Caribbean: Dead Men Tell No Tales","6.648","11176","Released","2017-05-23","795922298","128","False","/7C921eWK06n12c1miRXnYoEu5Yv.jpg","230000000","https://movies.disney.com/pirates-of-the-caribbean-dead-men-tell-no-tales","tt1790809","en","Pirates of the Caribbean: Dead Men Tell No Tales","Thrust into an all-new adventure, a down-on-his-luck Capt. Jack Sparrow feels the winds of ill-fortune blowing even more strongly when deadly ghost sailors led by his old nemesis, the evil Capt. Salazar, escape from the Devil's Triangle. Jack's only hope of survival lies in seeking out the legendary Trident of Poseidon, but to find it, he must forge an uneasy alliance with a brilliant and beautiful astronomer and a headstrong young man in the British navy.","62.006","/qwoGfcg6YUS55nUweKGujHE54Wy.jpg","All pirates must die.","Adventure, Action, Fantasy","Walt Disney Pictures, Jerry Bruckheimer Films, Infinitum Nihil","United States of America","English"
"546554","Knives Out","7.847","11156","Released","2019-11-27","312897920","131","False","/4HWAQu28e2yaWrtupFPGFkdNU7V.jpg","40000000","https://www.lionsgate.com/movies/knives-out","tt8946378","en","Knives Out","When renowned crime novelist Harlan Thrombey is found dead at his estate just after his 85th birthday, the inquisitive and debonair Detective Benoit Blanc is mysteriously enlisted to investigate. From Harlan's dysfunctional family to his devoted staff, Blanc sifts through a web of red herrings and self-serving lies to uncover the truth behind Harlan's untimely death.","39.064","/pThyQovXQrw2m0s9x82twj48Jq4.jpg","Hell, any of them could have done it.","Comedy, Crime, Mystery","Lionsgate, MRC, T-Street Productions","United States of America","Spanish, English"
"489","Good Will Hunting","8.149","11111","Released","1997-12-05","225933435","127","False","/bpV8wn48s82au37QyUJ51S7X2Vf.jpg","10000000","http://www.miramax.com/movie/good-will-hunting","tt0119217","en","Good Will Hunting","Will Hunting has a genius-level IQ but chooses to work as a janitor at MIT. When he solves a difficult graduate-level math problem, his talents are discovered by Professor Gerald Lambeau, who decides to help the misguided youth reach his potential. When Will is arrested for attacking a police officer, Professor Lambeau makes a deal to get leniency for him if he will get treatment from therapist Sean Maguire.","56.169","/bABCBKYBK7A5G1x0FzoeoNfuj2.jpg","Some people can never believe in themselves, until someone believes in them.","Drama","Miramax, Lawrence Bender Productions, Be Gentlemen Limited Partnership","United States of America","English"
"216015","Fifty Shades of Grey","5.882","11101","Released","2015-02-11","571006128","125","False","/mgY8An5qVCgLh97KOWeJVJarskL.jpg","40000000","https://www.facebook.com/fiftyshadesofgreymovie","tt2322441","en","Fifty Shades of Grey","When college senior Anastasia Steele steps in for her sick roommate to interview prominent businessman Christian Grey for their campus paper, little does she realize the path her life will take. Christian, as enigmatic as he is rich and powerful, finds himself strangely drawn to Ana, and she to him. Though sexually inexperienced, Ana plunges headlong into an affair -- and learns that Christian's true sexual proclivities push the boundaries of pain and pleasure.","96.283","/63kGofUkt1Mx0SIL4XI4Z5AoSgt.jpg","Are you curious?","Drama, Romance, Thriller","Focus Features, Michael De Luca Productions, Trigger Street Productions","United States of America","English"
"350","The Devil Wears Prada","7.384","11089","Released","2006-06-29","326706115","109","False","/CpLAfXgSNeNRRbRzPrTuzKmIHO.jpg","35000000","http://www.devilwearspradamovie.com/","tt0458352","en","The Devil Wears Prada","Andy moves to New York to work in the fashion industry. Her boss is extremely demanding, cruel and won't let her succeed if she doesn't fit into the high class elegant look of their magazine.","50.84","/u6QBDGUCOEMRekna95ip2MxplbQ.jpg","Meet Andy Sachs. A million girls would kill to have her job. She's not one of them.","Comedy, Drama, Romance","Fox 2000 Pictures, Dune Entertainment, Major Studio Partners, Peninsula Films, 20th Century Fox","France, United States of America","English, French"
"103","Taxi Driver","8.2","11081","Released","1976-02-09","28600000","114","False","/6aoyUbvu0419XLKLIMoH0TkEicH.jpg","1900000","","tt0075314","en","Taxi Driver","A mentally unstable Vietnam War veteran works as a night-time taxi driver in New York City where the perceived decadence and sleaze feed his urge for violent action.","41.36","/ekstpH614fwDX8DUln1a2Opz0N8.jpg","On every street in every city, there's a nobody who dreams of being a somebody.","Crime, Drama","Italo/Judeo Productions, Bill/Phillips, Columbia Pictures","United States of America","English, Spanish"
"332562","A Star Is Born","7.503","11079","Released","2018-10-03","433888866","136","False","/dDYpjrwh1wNVQk0rEpc9P81wQt4.jpg","36000000","http://astarisbornmovie.com","tt1517451","en","A Star Is Born","Seasoned musician Jackson Maine discovers — and falls in love with — struggling artist Ally. She has just about given up on her dream to make it big as a singer — until Jack coaxes her into the spotlight. But even as Ally's career takes off, the personal side of their relationship is breaking down, as Jack fights an ongoing battle with his own internal demons.","27.891","/wrFpXMNBRj2PBiN4Z5kix51XaIZ.jpg","","Music, Drama, Romance","Thunder Road, 22 & Green, Gerber Pictures, Joint Effort, Malpaso Productions, Warner Bros. Pictures, Live Nation Productions","United States of America","English"
"228150","Fury","7.518","11021","Released","2014-10-15","211817906","135","False","/kdbLf3aTQsEXqYlH9vA4fzmnSFz.jpg","68000000","","tt2713180","en","Fury","In the last months of World War II, as the Allies make their final push in the European theatre, a battle-hardened U.S. Army sergeant named 'Wardaddy' commands a Sherman tank called 'Fury' and its five-man crew on a deadly mission behind enemy lines. Outnumbered and outgunned, Wardaddy and his men face overwhelming odds in their heroic attempts to strike at the heart of Nazi Germany.","90.378","/pfte7wdMobMF4CVHuOxyu6oqeeA.jpg","War never ends quietly.","War, Drama, Action","Columbia Pictures, QED International, LStar Capital, Le Grisbi Productions, Crave Films, Sony Pictures, Huayi Brothers Pictures","United Kingdom, United States of America, China","English, German, Spanish"
"1724","The Incredible Hulk","6.204","11006","Released","2008-06-12","163712074","114","False","/xfBnQ4mgf1jYZsscJGJjr6ce0Ar.jpg","150000000","https://www.marvel.com/movies/the-incredible-hulk","tt0800080","en","The Incredible Hulk","Scientist Bruce Banner scours the planet for an antidote to the unbridled force of rage within him: the Hulk. But when the military masterminds who dream of exploiting his powers force him back to civilization, he finds himself coming face to face with a new, deadly foe.","52.734","/gKzYx79y0AQTL4UAk1cBQJ3nvrm.jpg","You'll like him when he's angry.","Science Fiction, Action, Adventure","Marvel Studios, Valhalla Motion Pictures","United States of America","Portuguese, Spanish, English"
"23483","Kick-Ass","7.12","10997","Released","2010-03-22","96188903","117","False","/P4bGyJQF0shAcRku3I2perNUQR.jpg","28000000","","tt1250777","en","Kick-Ass","Dave Lizewski is an unnoticed high school student and comic book fan who one day decides to become a super-hero, even though he has no powers, training or meaningful reason to do so.","38.557","/8citjdBmjddZjlPsAHEyCKwGVvD.jpg","Shut up. Kick-Ass.","Action, Crime","Marv Films, Lionsgate, Plan B Entertainment, Mandate International","United Kingdom, United States of America","English"
"2048","I, Robot","6.939","10972","Released","2004-07-15","347234916","115","False","/lOXVbF2mBK0xUt8sLInF3TIk5YS.jpg","120000000","","tt0343818","en","I, Robot","In 2035, where robots are commonplace and abide by the three laws of robotics, a technophobic cop investigates an apparent suicide. Suspecting that a robot may be responsible for the death, his investigation leads him to believe that humanity may be in danger.","27.677","/dlb6JKYv25rJSk2n2hwhOeJ7Dk.jpg","Laws are made to be broken.","Action, Science Fiction","Davis Entertainment, Laurence Mark Productions, Canlaws Productions, 20th Century Fox, Overbrook Entertainment, Mediastream Vierte Film GmbH & Co. Vermarktungs KG","United States of America, Germany","English"
"6977","No Country for Old Men","7.933","10964","Released","2007-06-13","171627166","122","False","/kd9jFTTabg4xJpHDgxY0h8F9BzG.jpg","25000000","","tt0477348","en","No Country for Old Men","Llewelyn Moss stumbles upon dead bodies, $2 million and a hoard of heroin in a Texas desert, but methodical killer Anton Chigurh comes looking for it, with local sheriff Ed Tom Bell hot on his trail. The roles of prey and predator blur as the violent pursuit of money and justice collide.","33.115","/bj1v6YKF8yHqA489VFfnQvOJpnc.jpg","There are no clean getaways.","Crime, Drama, Thriller","Miramax, Scott Rudin Productions, Mike Zoss Productions, Paramount Vantage","United States of America","English, Spanish"
"61791","Rise of the Planet of the Apes","7.289","10799","Released","2011-08-03","482860185","105","False","/v7JTQy194gRbljdlK4OJhwnOypQ.jpg","93000000","https://www.20thcenturystudios.com/movies/rise-of-the-planet-of-the-apes","tt1318514","en","Rise of the Planet of the Apes","A highly intelligent chimpanzee named Caesar has been living a peaceful suburban life ever since he was born. But when he gets taken to a cruel primate facility, Caesar decides to revolt against those who have harmed him.","38.032","/cjLsuP75UDlRdJVMXzXg3TJ4umX.jpg","Evolution Becomes Revolution.","Thriller, Action, Drama, Science Fiction","Dune Entertainment III, Dune Entertainment, Chernin Entertainment, Ingenious Media, Big Screen Productions, 20th Century Fox","United States of America","English"
"161","Ocean's Eleven","7.43","10774","Released","2001-12-07","450717150","116","False","/boI3myFhWBvQcru4zZ15aJ0u3CX.jpg","85000000","http://www.warnerbros.co.uk/movies/oceans-eleven","tt0240772","en","Ocean's Eleven","Less than 24 hours into his parole, charismatic thief Danny Ocean is already rolling out his next plan: In one night, Danny's hand-picked crew of specialists will attempt to steal more than $150 million from three Las Vegas casinos. But to score the cash, Danny risks his chances of reconciling with ex-wife, Tess.","39.17","/hQQCdZrsHtZyR6NbKH2YyCqd2fR.jpg","Are you in or out?","Thriller, Crime","Village Roadshow Pictures, NPV Entertainment, Jerry Weintraub Productions, Section Eight, Warner Bros. Pictures","United States of America","Italian, English"
"745","The Sixth Sense","7.944","10754","Released","1999-08-06","672806292","107","False","/6TjllWT3cGrPFyqDXurVZ3L8bBi.jpg","40000000","","tt0167404","en","The Sixth Sense","Following an unexpected tragedy, child psychologist Malcolm Crowe meets a nine year old boy named Cole Sear, who is hiding a dark secret.","32.836","/4AfSDjjCy6T5LA1TMz0Lh2HlpRh.jpg","Not every gift is a blessing.","Mystery, Thriller, Drama","Spyglass Entertainment, The Kennedy/Marshall Company, Hollywood Pictures, Barry Mendel Productions","United States of America","Latin, Spanish, English"
"194","Amélie","7.905","10750","Released","2001-04-25","173921954","122","False","/9TEUJy5aRP7LaM1LKTfcxVK34JK.jpg","10000000","https://www.miramax.com/movie/amelie/","tt0211915","fr","Le Fabuleux Destin d'Amélie Poulain","At a tiny Parisian café, the adorable yet painfully shy Amélie accidentally discovers a gift for helping others. Soon Amelie is spending her days as a matchmaker, guardian angel, and all-around do-gooder. But when she bumps into a handsome stranger, will she find the courage to become the star of her very own love story?","42.494","/nSxDa3M9aMvGVLoItzWTepQ5h5d.jpg","One person can change your life forever.","Comedy, Romance","France 3 Cinéma, Claudie Ossard Productions, MMC Independent, Tapioca Films, Sofica Sofinergie 5, Victoires Productions, Canal+, Filmstiftung Nordrhein-Westfalen, Union Générale Cinématographique (UGC), Miramax","France, Germany","French, Russian"
"111","Scarface","8.168","10749","Released","1983-12-09","66023329","169","False","/cCvp5Sni75agCtyJkNOMapORUQV.jpg","25000000","","tt0086250","en","Scarface","After getting a green card in exchange for assassinating a Cuban government official, Tony Montana stakes a claim on the drug trade in Miami. Viciously murdering anyone who stands in his way, Tony eventually becomes the biggest drug lord in the state, controlling nearly all the cocaine that comes through Miami. But increased pressure from the police, wars with Colombian drug cartels and his own drug-fueled paranoia serve to fuel the flames of his eventual downfall.","54.199","/iQ5ztdjvteGeboxtmRdXEChJOHh.jpg","The world is yours...","Action, Crime, Drama","Universal Pictures","United States of America","English, Spanish"
"146233","Prisoners","8.091","10748","Released","2013-09-19","122126687","153","False","/tlK9mWLquPawoHT9jIWe9WGANKx.jpg","46000000","https://www.warnerbros.com/movies/prisoners","tt1392214","en","Prisoners","Keller Dover faces a parent's worst nightmare when his 6-year-old daughter, Anna, and her friend go missing. The only lead is an old motorhome that had been parked on their street. The head of the investigation, Detective Loki, arrests the driver, but a lack of evidence forces Loki to release his only suspect. Dover, knowing that his daughter's life is at stake, decides that he has no choice but to take matters into his own hands.","35.085","/tuZhZ6biFMr5n9YSVuHOJnNL1uU.jpg","Every moment matters.","Drama, Thriller, Crime","Madhouse Entertainment, Alcon Entertainment, 8:38 Productions, Warner Bros. Pictures, Summit Entertainment","United States of America","English"
"73","American History X","8.352","10729","Released","1998-07-01","23875127","119","False","/9LSsSPbP715XT9B7acIZzantPyX.jpg","20000000","","tt0120586","en","American History X","Derek Vineyard is paroled after serving 3 years in prison for killing two African-American men. Through his brother, Danny Vineyard's narration, we learn that before going to prison, Derek was a skinhead and the leader of a violent white supremacist gang that committed acts of racial crime throughout L.A. and his actions greatly influenced Danny. Reformed and fresh out of prison, Derek severs contact with the gang and becomes determined to keep Danny from going down the same violent path as he did.","36.427","/euypWkaYFOLW3e5rLIcTAjWnhhT.jpg","Some Legacies Must End.","Drama","New Line Cinema, Savoy Pictures, The Turman-Morrissey Company","United States of America","English"
"138843","The Conjuring","7.541","10683","Released","2013-07-18","320406242","112","False","/aQCCpAIdWAp6wyFgjMry4okwrZo.jpg","13000000","http://theconjuring.warnerbros.com","tt1457767","en","The Conjuring","Paranormal investigators Ed and Lorraine Warren work to help a family terrorized by a dark presence in their farmhouse. Forced to confront a powerful entity, the Warrens find themselves caught in the most terrifying case of their lives.","105.394","/wVYREutTvI2tmxr6ujrHT704wGF.jpg","Based on the true case files of the Warrens","Horror, Thriller","Evergreen Media Group, New Line Cinema, The Safran Company","United States of America","English"
"222935","The Fault in Our Stars","7.598","10655","Released","2014-05-16","307166834","126","False","/oQaVV7p916HO5MDI820zzs1pin9.jpg","14000000","","tt2582846","en","The Fault in Our Stars","Despite the tumor-shrinking medical miracle that has bought her a few years, Hazel has never been anything but terminal, her final chapter inscribed upon diagnosis. But when a patient named Augustus Waters suddenly appears at Cancer Kid Support Group, Hazel's story is about to be completely rewritten.","30.209","/ep7dF4QR4Mm39LI958V0XbwE0hK.jpg","","Romance, Drama","TSG Entertainment, Fox 2000 Pictures, Temple Hill Entertainment","United States of America","English"
